{
  "schemaVersion": "1.0.0",
  "id": "cp00994-carolina-herrera-212-sexy-men",
  "status": "review",
  "identity": {
    "brand": "CAROLINA HERRERA",
    "name": "212 SEXY MEN",
    "line": null,
    "flanker": null,
    "priveCode": "CP00994",
    "sku": null,
    "audience": "Caballero",
    "concentration": "Eau de Toilette",
    "launchYear": 2006,
    "perfumers": [],
    "countryOfOrigin": null
  },
  "classification": {
    "family": "Ámbar fougère",
    "subfamily": null,
    "accords": [
      "Especiado",
      "Vainilla",
      "Amaderado",
      "Cítrico"
    ],
    "styleTags": [
      "Seductor",
      "Cálido y nocturno"
    ]
  },
  "olfactory": {
    "topNotes": [
      "Mandarina",
      "Bergamota",
      "Notas verdes"
    ],
    "heartNotes": [
      "Pimienta",
      "Cardamomo",
      "Notas florales"
    ],
    "baseNotes": [
      "Vainilla",
      "Madera de guayaco",
      "Sándalo",
      "Almizcle",
      "Ámbar"
    ],
    "notePyramidConfidence": "medium"
  },
  "performance": {
    "intensity": "Intensa",
    "longevity": "Desconocida",
    "projection": "Desconocida",
    "trail": "Desconocida",
    "longevityHours": {
      "min": null,
      "max": null
    }
  },
  "sensoryProfile": {
    "freshness": 5,
    "sweetness": 2,
    "warmth": 4,
    "woodiness": 5,
    "spiciness": 5,
    "floral": 0,
    "citrus": 5,
    "fruitiness": 0,
    "aquatic": 0,
    "powdery": 2,
    "smoky": 0,
    "leathery": 0
  },
  "recommendation": {
    "occasions": [
      "Noche",
      "Cita",
      "Fiesta",
      "Evento"
    ],
    "contexts": [
      "Romántico",
      "Social",
      "Especial"
    ],
    "climates": [
      "Frío",
      "Templado"
    ],
    "seasons": [
      "Otoño",
      "Invierno"
    ],
    "dayParts": [
      "Tarde",
      "Noche"
    ],
    "formality": 2,
    "versatility": 3,
    "distinctiveness": 3,
    "recommendedAge": {
      "min": 22,
      "max": 48,
      "confidence": "low",
      "framing": "tendency",
      "isRestrictive": false,
      "guidance": "Tendencia orientativa: suele conectar especialmente con personas de 22 a 48 años por su estilo seductor, cálido y nocturno. No es una regla ni limita su uso: si te atraen sus notas y la imagen que proyecta, puede funcionar muy bien a cualquier edad. Si buscas una impresión más juvenil o más clásica, el Asesor PRIVÉ puede sugerirte alternativas cercanas."
    }
  },
  "content": {
    "shortDescription": "Una fragancia de perfil especiado, vainilla, amaderado, con una salida de mandarina, bergamota, notas verdes que evoluciona hacia un fondo de vainilla, madera de guayaco, sándalo. Su carácter seductor, cálido y nocturno ayuda al Asesor PRIVÉ a ubicarla por gusto, ocasión y clima sin convertir la edad en una regla.",
    "advisorSummary": "Perfil seductor, cálido y nocturno. Afinidad orientativa: 22 a 48 años; sus notas pueden funcionar a cualquier edad según tus gustos y la imagen que deseas proyectar.",
    "wearingTips": [
      "Suele rendir mejor en clima frío y templado.",
      "La edad es solo una tendencia de afinidad; prioriza el aroma, la ocasión y la imagen que quieres proyectar."
    ],
    "image": {
      "path": "IMAGES/Caballero/CP00994.avif",
      "alt": "CAROLINA HERRERA 212 SEXY MEN"
    }
  },
  "provenance": {
    "lastReviewedAt": "2026-07-30",
    "reviewedBy": "PRIVÉ — Base Maestra Lote 002",
    "confidence": "medium",
    "sources": [
      {
        "type": "internal",
        "title": "Catálogo operativo PRIVÉ — nombre, imagen, categoría y clave",
        "url": null,
        "accessedAt": "2026-07-30",
        "supports": [
          "identity"
        ]
      },
      {
        "type": "community",
        "title": "Fragrantica — nombre, versión, imagen y contraste olfativo",
        "url": "https://www.fragrantica.com/search/?query=CAROLINA+HERRERA+212+SEXY+MEN",
        "accessedAt": "2026-07-30",
        "supports": [
          "identity",
          "classification",
          "olfactory"
        ]
      },
      {
        "type": "editorial",
        "title": "Perfumoteca — búsqueda exacta por clave CP00994",
        "url": "https://perfumoteca.com/catalogo",
        "accessedAt": "2026-07-30",
        "supports": [
          "identity",
          "olfactory"
        ]
      }
    ],
    "notes": "Lote maestro 002. Fragrantica y Perfumoteca se registran como fuentes principales complementarias: Fragrantica conserva nombre/versión/imagen; Perfumoteca se consulta por clave y representa la referencia olfativa usada por proveedor y pedidos PRIVÉ. Identidad contrastada por nombre e imagen; clave conservada para búsqueda exacta en Perfumoteca. La ficha permanece en review; no se inventan datos ante diferencias. La edad es orientativa y nunca restrictiva."
  }
}
