{
  "schemaVersion": "1.0.0",
  "id": "cp02158-dior-sauvage",
  "status": "review",
  "identity": {
    "brand": "DIOR",
    "name": "SAUVAGE",
    "line": null,
    "flanker": null,
    "priveCode": "CP02158",
    "sku": null,
    "audience": "Caballero",
    "concentration": "Eau de Toilette",
    "launchYear": 2015,
    "perfumers": [],
    "countryOfOrigin": null
  },
  "classification": {
    "family": "Aromática fougère",
    "subfamily": null,
    "accords": [
      "Cítrico",
      "Especiado",
      "Ambroxan",
      "Aromático"
    ],
    "styleTags": [
      "Potente",
      "Fresco y seguro"
    ]
  },
  "olfactory": {
    "topNotes": [
      "Bergamota de Calabria",
      "Pimienta"
    ],
    "heartNotes": [
      "Pimienta de Sichuan",
      "Lavanda",
      "Pimienta rosa",
      "Vetiver",
      "Pachulí",
      "Geranio",
      "Elemi"
    ],
    "baseNotes": [
      "Ambroxan",
      "Cedro",
      "Ládano"
    ],
    "notePyramidConfidence": "medium"
  },
  "performance": {
    "intensity": "Intensa",
    "longevity": "Desconocida",
    "projection": "Desconocida",
    "trail": "Desconocida",
    "longevityHours": {
      "min": null,
      "max": null
    }
  },
  "sensoryProfile": {
    "freshness": 4,
    "sweetness": 0,
    "warmth": 0,
    "woodiness": 5,
    "spiciness": 4,
    "floral": 5,
    "citrus": 4,
    "fruitiness": 0,
    "aquatic": 0,
    "powdery": 0,
    "smoky": 2,
    "leathery": 0
  },
  "recommendation": {
    "occasions": [
      "Día",
      "Noche",
      "Diario",
      "Oficina",
      "Cita"
    ],
    "contexts": [
      "Casual",
      "Profesional",
      "Social"
    ],
    "climates": [
      "Templado",
      "Calor",
      "Frío"
    ],
    "seasons": [
      "Primavera",
      "Otoño",
      "Verano"
    ],
    "dayParts": [
      "Mañana",
      "Tarde",
      "Noche"
    ],
    "formality": 3,
    "versatility": 5,
    "distinctiveness": 3,
    "recommendedAge": {
      "min": 18,
      "max": 55,
      "confidence": "low",
      "framing": "tendency",
      "isRestrictive": false,
      "guidance": "Tendencia orientativa: suele conectar especialmente con personas de 18 a 55 años por su estilo potente, fresco y seguro. No es una regla ni limita su uso: si te atraen sus notas y la imagen que proyecta, puede funcionar muy bien a cualquier edad. Si buscas una impresión más juvenil o más clásica, el Asesor PRIVÉ puede sugerirte alternativas cercanas."
    }
  },
  "content": {
    "shortDescription": "Una fragancia de perfil cítrico, especiado, ambroxan, con una salida de bergamota de calabria, pimienta que evoluciona hacia un fondo de ambroxan, cedro, ládano. Su carácter potente, fresco y seguro ayuda al Asesor PRIVÉ a ubicarla por gusto, ocasión y clima sin convertir la edad en una regla.",
    "advisorSummary": "Perfil potente, fresco y seguro. Afinidad orientativa: 18 a 55 años; sus notas pueden funcionar a cualquier edad según tus gustos y la imagen que deseas proyectar.",
    "wearingTips": [
      "Suele rendir mejor en clima templado y calor y frío.",
      "La edad es solo una tendencia de afinidad; prioriza el aroma, la ocasión y la imagen que quieres proyectar."
    ],
    "image": {
      "path": "IMAGES/Caballero/CP02158.avif",
      "alt": "DIOR SAUVAGE"
    }
  },
  "provenance": {
    "lastReviewedAt": "2026-07-30",
    "reviewedBy": "PRIVÉ — Base Maestra Lote 002",
    "confidence": "medium",
    "sources": [
      {
        "type": "internal",
        "title": "Catálogo operativo PRIVÉ — nombre, imagen, categoría y clave",
        "url": null,
        "accessedAt": "2026-07-30",
        "supports": [
          "identity"
        ]
      },
      {
        "type": "community",
        "title": "Fragrantica — nombre, versión, imagen y contraste olfativo",
        "url": "https://www.fragrantica.com/search/?query=DIOR+SAUVAGE",
        "accessedAt": "2026-07-30",
        "supports": [
          "identity",
          "classification",
          "olfactory"
        ]
      },
      {
        "type": "editorial",
        "title": "Perfumoteca — búsqueda exacta por clave CP02158",
        "url": "https://perfumoteca.com/catalogo",
        "accessedAt": "2026-07-30",
        "supports": [
          "identity",
          "olfactory"
        ]
      }
    ],
    "notes": "Lote maestro 002. Fragrantica y Perfumoteca se registran como fuentes principales complementarias: Fragrantica conserva nombre/versión/imagen; Perfumoteca se consulta por clave y representa la referencia olfativa usada por proveedor y pedidos PRIVÉ. Identidad contrastada por nombre e imagen; clave conservada para búsqueda exacta en Perfumoteca. La ficha permanece en review; no se inventan datos ante diferencias. La edad es orientativa y nunca restrictiva."
  }
}
