{
  "schemaVersion": "1.0.0",
  "id": "cp00783-davidoff-cool-water-para-hombres",
  "status": "review",
  "identity": {
    "brand": "DAVIDOFF",
    "name": "COOL WATER PARA HOMBRES",
    "line": null,
    "flanker": null,
    "priveCode": "CP00783",
    "sku": null,
    "audience": "Caballero",
    "concentration": "Eau de Toilette",
    "launchYear": 1988,
    "perfumers": [],
    "countryOfOrigin": null
  },
  "classification": {
    "family": "Aromática acuática",
    "subfamily": null,
    "accords": [
      "Acuático",
      "Verde",
      "Aromático",
      "Fresco"
    ],
    "styleTags": [
      "Marino",
      "Clásico y refrescante"
    ]
  },
  "olfactory": {
    "topNotes": [
      "Agua de mar",
      "Lavanda",
      "Menta",
      "Notas verdes",
      "Romero",
      "Calone",
      "Cilantro"
    ],
    "heartNotes": [
      "Sándalo",
      "Neroli",
      "Geranio",
      "Jazmín"
    ],
    "baseNotes": [
      "Almizcle",
      "Tabaco",
      "Musgo de roble",
      "Cedro",
      "Ámbar"
    ],
    "notePyramidConfidence": "medium"
  },
  "performance": {
    "intensity": "Moderada",
    "longevity": "Desconocida",
    "projection": "Desconocida",
    "trail": "Desconocida",
    "longevityHours": {
      "min": null,
      "max": null
    }
  },
  "sensoryProfile": {
    "freshness": 5,
    "sweetness": 0,
    "warmth": 4,
    "woodiness": 4,
    "spiciness": 2,
    "floral": 5,
    "citrus": 2,
    "fruitiness": 0,
    "aquatic": 5,
    "powdery": 2,
    "smoky": 2,
    "leathery": 0
  },
  "recommendation": {
    "occasions": [
      "Día",
      "Diario",
      "Oficina",
      "Viaje",
      "Playa"
    ],
    "contexts": [
      "Casual",
      "Profesional",
      "Vacaciones"
    ],
    "climates": [
      "Calor",
      "Templado"
    ],
    "seasons": [
      "Primavera",
      "Verano"
    ],
    "dayParts": [
      "Mañana",
      "Tarde"
    ],
    "formality": 3,
    "versatility": 4,
    "distinctiveness": 4,
    "recommendedAge": {
      "min": 18,
      "max": 58,
      "confidence": "low",
      "framing": "tendency",
      "isRestrictive": false,
      "guidance": "Tendencia orientativa: suele conectar especialmente con personas de 18 a 58 años por su estilo marino, clásico y refrescante. No es una regla ni limita su uso: si te atraen sus notas y la imagen que proyecta, puede funcionar muy bien a cualquier edad. Si buscas una impresión más juvenil o más clásica, el Asesor PRIVÉ puede sugerirte alternativas cercanas."
    }
  },
  "content": {
    "shortDescription": "Una fragancia de perfil acuático, verde, aromático, con una salida de agua de mar, lavanda, menta que evoluciona hacia un fondo de almizcle, tabaco, musgo de roble. Su carácter marino, clásico y refrescante ayuda al Asesor PRIVÉ a ubicarla por gusto, ocasión y clima sin convertir la edad en una regla.",
    "advisorSummary": "Perfil marino, clásico y refrescante. Afinidad orientativa: 18 a 58 años; sus notas pueden funcionar a cualquier edad según tus gustos y la imagen que deseas proyectar.",
    "wearingTips": [
      "Suele rendir mejor en clima calor y templado.",
      "La edad es solo una tendencia de afinidad; prioriza el aroma, la ocasión y la imagen que quieres proyectar."
    ],
    "image": {
      "path": "IMAGES/Caballero/CP00783.avif",
      "alt": "DAVIDOFF COOL WATER PARA HOMBRES"
    }
  },
  "provenance": {
    "lastReviewedAt": "2026-07-30",
    "reviewedBy": "PRIVÉ — Base Maestra Lote 002",
    "confidence": "medium",
    "sources": [
      {
        "type": "internal",
        "title": "Catálogo operativo PRIVÉ — nombre, imagen, categoría y clave",
        "url": null,
        "accessedAt": "2026-07-30",
        "supports": [
          "identity"
        ]
      },
      {
        "type": "community",
        "title": "Fragrantica — nombre, versión, imagen y contraste olfativo",
        "url": "https://www.fragrantica.com/search/?query=DAVIDOFF+COOL+WATER+PARA+HOMBRES",
        "accessedAt": "2026-07-30",
        "supports": [
          "identity",
          "classification",
          "olfactory"
        ]
      },
      {
        "type": "editorial",
        "title": "Perfumoteca — búsqueda exacta por clave CP00783",
        "url": "https://perfumoteca.com/catalogo",
        "accessedAt": "2026-07-30",
        "supports": [
          "identity",
          "olfactory"
        ]
      }
    ],
    "notes": "Lote maestro 002. Fragrantica y Perfumoteca se registran como fuentes principales complementarias: Fragrantica conserva nombre/versión/imagen; Perfumoteca se consulta por clave y representa la referencia olfativa usada por proveedor y pedidos PRIVÉ. Identidad contrastada por nombre e imagen; clave conservada para búsqueda exacta en Perfumoteca. La ficha permanece en review; no se inventan datos ante diferencias. La edad es orientativa y nunca restrictiva."
  }
}
