{
  "schemaVersion": "1.0.0",
  "id": "cp02203-hugo-boss-boss-bottled-tonic",
  "status": "review",
  "identity": {
    "brand": "HUGO BOSS",
    "name": "BOSS BOTTLED TONIC",
    "line": null,
    "flanker": null,
    "priveCode": "CP02203",
    "sku": null,
    "audience": "Caballero",
    "concentration": "Eau de Toilette",
    "launchYear": 2017,
    "perfumers": [],
    "countryOfOrigin": null
  },
  "classification": {
    "family": "Amaderada especiada",
    "subfamily": null,
    "accords": [
      "Cítrico",
      "Afrutado",
      "Especiado",
      "Amaderado"
    ],
    "styleTags": [
      "Ligero",
      "Profesional y refrescante"
    ]
  },
  "olfactory": {
    "topNotes": [
      "Manzana",
      "Naranja amarga",
      "Toronja",
      "Limón"
    ],
    "heartNotes": [
      "Jengibre",
      "Canela",
      "Geranio",
      "Clavo"
    ],
    "baseNotes": [
      "Vetiver",
      "Notas amaderadas"
    ],
    "notePyramidConfidence": "medium"
  },
  "performance": {
    "intensity": "Moderada",
    "longevity": "Desconocida",
    "projection": "Desconocida",
    "trail": "Desconocida",
    "longevityHours": {
      "min": null,
      "max": null
    }
  },
  "sensoryProfile": {
    "freshness": 5,
    "sweetness": 4,
    "warmth": 4,
    "woodiness": 4,
    "spiciness": 5,
    "floral": 2,
    "citrus": 5,
    "fruitiness": 4,
    "aquatic": 2,
    "powdery": 0,
    "smoky": 0,
    "leathery": 0
  },
  "recommendation": {
    "occasions": [
      "Día",
      "Diario",
      "Oficina",
      "Viaje",
      "Playa"
    ],
    "contexts": [
      "Casual",
      "Profesional",
      "Vacaciones"
    ],
    "climates": [
      "Calor",
      "Templado"
    ],
    "seasons": [
      "Primavera",
      "Verano"
    ],
    "dayParts": [
      "Mañana",
      "Tarde"
    ],
    "formality": 3,
    "versatility": 4,
    "distinctiveness": 3,
    "recommendedAge": {
      "min": 20,
      "max": 50,
      "confidence": "low",
      "framing": "tendency",
      "isRestrictive": false,
      "guidance": "Tendencia orientativa: suele conectar especialmente con personas de 20 a 50 años por su estilo ligero, profesional y refrescante. No es una regla ni limita su uso: si te atraen sus notas y la imagen que proyecta, puede funcionar muy bien a cualquier edad. Si buscas una impresión más juvenil o más clásica, el Asesor PRIVÉ puede sugerirte alternativas cercanas."
    }
  },
  "content": {
    "shortDescription": "Una fragancia de perfil cítrico, afrutado, especiado, con una salida de manzana, naranja amarga, toronja que evoluciona hacia un fondo de vetiver, notas amaderadas. Su carácter ligero, profesional y refrescante ayuda al Asesor PRIVÉ a ubicarla por gusto, ocasión y clima sin convertir la edad en una regla.",
    "advisorSummary": "Perfil ligero, profesional y refrescante. Afinidad orientativa: 20 a 50 años; sus notas pueden funcionar a cualquier edad según tus gustos y la imagen que deseas proyectar.",
    "wearingTips": [
      "Suele rendir mejor en clima calor y templado.",
      "La edad es solo una tendencia de afinidad; prioriza el aroma, la ocasión y la imagen que quieres proyectar."
    ],
    "image": {
      "path": "IMAGES/Caballero/CP02203.avif",
      "alt": "HUGO BOSS BOSS BOTTLED TONIC"
    }
  },
  "provenance": {
    "lastReviewedAt": "2026-07-30",
    "reviewedBy": "PRIVÉ — Base Maestra Lote 002",
    "confidence": "medium",
    "sources": [
      {
        "type": "internal",
        "title": "Catálogo operativo PRIVÉ — nombre, imagen, categoría y clave",
        "url": null,
        "accessedAt": "2026-07-30",
        "supports": [
          "identity"
        ]
      },
      {
        "type": "community",
        "title": "Fragrantica — nombre, versión, imagen y contraste olfativo",
        "url": "https://www.fragrantica.com/search/?query=HUGO+BOSS+BOSS+BOTTLED+TONIC",
        "accessedAt": "2026-07-30",
        "supports": [
          "identity",
          "classification",
          "olfactory"
        ]
      },
      {
        "type": "editorial",
        "title": "Perfumoteca — búsqueda exacta por clave CP02203",
        "url": "https://perfumoteca.com/catalogo",
        "accessedAt": "2026-07-30",
        "supports": [
          "identity",
          "olfactory"
        ]
      }
    ],
    "notes": "Lote maestro 002. Fragrantica y Perfumoteca se registran como fuentes principales complementarias: Fragrantica conserva nombre/versión/imagen; Perfumoteca se consulta por clave y representa la referencia olfativa usada por proveedor y pedidos PRIVÉ. Identidad contrastada por nombre e imagen; clave conservada para búsqueda exacta en Perfumoteca. La ficha permanece en review; no se inventan datos ante diferencias. La edad es orientativa y nunca restrictiva."
  }
}
