{
  "schemaVersion": "1.0.0",
  "id": "cp01004-armani-emporio-armani-diamonds-for-men",
  "status": "review",
  "identity": {
    "brand": "ARMANI",
    "name": "EMPORIO ARMANI DIAMONDS FOR MEN",
    "line": null,
    "flanker": null,
    "priveCode": "CP01004",
    "sku": null,
    "audience": "Caballero",
    "concentration": "Eau de Toilette",
    "launchYear": 2008,
    "perfumers": [],
    "countryOfOrigin": null
  },
  "classification": {
    "family": "Amaderada aromática",
    "subfamily": null,
    "accords": [
      "Amaderado",
      "Cítrico",
      "Cacao",
      "Especiado"
    ],
    "styleTags": [
      "Elegante",
      "Seco y original"
    ]
  },
  "olfactory": {
    "topNotes": [
      "Bergamota",
      "Madera de guayaco"
    ],
    "heartNotes": [
      "Pimienta de Sichuan",
      "Cedro",
      "Vetiver"
    ],
    "baseNotes": [
      "Cacao",
      "Ámbar"
    ],
    "notePyramidConfidence": "low"
  },
  "performance": {
    "intensity": "Moderada",
    "longevity": "Desconocida",
    "projection": "Desconocida",
    "trail": "Desconocida",
    "longevityHours": {
      "min": null,
      "max": null
    }
  },
  "sensoryProfile": {
    "freshness": 2,
    "sweetness": 2,
    "warmth": 2,
    "woodiness": 5,
    "spiciness": 2,
    "floral": 0,
    "citrus": 2,
    "fruitiness": 0,
    "aquatic": 0,
    "powdery": 0,
    "smoky": 0,
    "leathery": 0
  },
  "recommendation": {
    "occasions": [
      "Día",
      "Noche",
      "Oficina",
      "Evento"
    ],
    "contexts": [
      "Profesional",
      "Formal",
      "Especial"
    ],
    "climates": [
      "Templado",
      "Frío"
    ],
    "seasons": [
      "Otoño",
      "Invierno",
      "Primavera"
    ],
    "dayParts": [
      "Tarde",
      "Noche"
    ],
    "formality": 4,
    "versatility": 4,
    "distinctiveness": 3,
    "recommendedAge": {
      "min": 25,
      "max": 50,
      "confidence": "low",
      "framing": "tendency",
      "isRestrictive": false,
      "guidance": "Tendencia orientativa: suele conectar especialmente con personas de 25 a 50 años por su estilo elegante, seco y original. No es una regla ni limita su uso: si te atraen sus notas y la imagen que proyecta, puede funcionar muy bien a cualquier edad."
    }
  },
  "content": {
    "shortDescription": "Una fragancia de perfil amaderado, cítrico, cacao, con una salida de bergamota, madera de guayaco que evoluciona hacia un fondo de cacao, ámbar. Su carácter elegante, seco y original la hace fácil de ubicar según ocasión y clima.",
    "advisorSummary": "Perfil elegante, seco y original. Afinidad orientativa: 25 a 50 años; sus notas pueden funcionar a cualquier edad según tus gustos y la imagen que deseas proyectar.",
    "wearingTips": [
      "Rinde mejor en clima templado y frío.",
      "El rango de edad es orientativo; prioriza siempre tus gustos y la imagen que quieres proyectar."
    ],
    "image": {
      "path": "IMAGES/Caballero/CP01004.avif",
      "alt": "ARMANI EMPORIO ARMANI DIAMONDS FOR MEN"
    }
  },
  "provenance": {
    "lastReviewedAt": "2026-07-30",
    "reviewedBy": "PRIVÉ — revisión de lote",
    "confidence": "low",
    "sources": [
      {
        "type": "internal",
        "title": "Catálogo operativo PRIVÉ",
        "url": null,
        "accessedAt": "2026-07-30",
        "supports": [
          "identity"
        ]
      },
      {
        "type": "internal",
        "title": "Revisión documental PRIVÉ — Lote maestro 001",
        "url": null,
        "accessedAt": "2026-07-30",
        "supports": [
          "classification",
          "olfactory",
          "recommendation",
          "content"
        ]
      }
    ],
    "notes": "Lote maestro 001. Ficha en estado review: validar la pirámide y la tendencia de edad antes de cambiar a verified. La edad es una tendencia secundaria, nunca una restricción de compra."
  }
}
