{
  "schemaVersion": "1.0.0",
  "id": "cp02316-armani-emporio-armani-stronger-with-you-oud",
  "status": "review",
  "identity": {
    "brand": "ARMANI",
    "name": "EMPORIO ARMANI STRONGER WITH YOU OUD",
    "line": null,
    "flanker": null,
    "priveCode": "CP02316",
    "sku": null,
    "audience": "Caballero",
    "concentration": "Eau de Parfum",
    "launchYear": 2022,
    "perfumers": [],
    "countryOfOrigin": null
  },
  "classification": {
    "family": "Ámbar amaderada",
    "subfamily": null,
    "accords": [
      "Oud",
      "Vainilla",
      "Aromático",
      "Amaderado"
    ],
    "styleTags": [
      "Oscuro",
      "Lujoso y minimalista"
    ]
  },
  "olfactory": {
    "topNotes": [
      "Lavanda"
    ],
    "heartNotes": [
      "Oud"
    ],
    "baseNotes": [
      "Vainilla"
    ],
    "notePyramidConfidence": "low"
  },
  "performance": {
    "intensity": "Muy intensa",
    "longevity": "Desconocida",
    "projection": "Desconocida",
    "trail": "Desconocida",
    "longevityHours": {
      "min": null,
      "max": null
    }
  },
  "sensoryProfile": {
    "freshness": 0,
    "sweetness": 2,
    "warmth": 4,
    "woodiness": 2,
    "spiciness": 0,
    "floral": 2,
    "citrus": 0,
    "fruitiness": 0,
    "aquatic": 0,
    "powdery": 0,
    "smoky": 0,
    "leathery": 0
  },
  "recommendation": {
    "occasions": [
      "Noche",
      "Cita",
      "Evento"
    ],
    "contexts": [
      "Formal",
      "Romántico",
      "Especial"
    ],
    "climates": [
      "Frío"
    ],
    "seasons": [
      "Otoño",
      "Invierno"
    ],
    "dayParts": [
      "Noche"
    ],
    "formality": 4,
    "versatility": 3,
    "distinctiveness": 4,
    "recommendedAge": {
      "min": 25,
      "max": 50,
      "confidence": "low",
      "framing": "tendency",
      "isRestrictive": false,
      "guidance": "Tendencia orientativa: suele conectar especialmente con personas de 25 a 50 años por su estilo oscuro, lujoso y minimalista. No es una regla ni limita su uso: si te atraen sus notas y la imagen que proyecta, puede funcionar muy bien a cualquier edad."
    }
  },
  "content": {
    "shortDescription": "Una fragancia de perfil oud, vainilla, aromático, con una salida de lavanda que evoluciona hacia un fondo de vainilla. Su carácter oscuro, lujoso y minimalista la hace fácil de ubicar según ocasión y clima.",
    "advisorSummary": "Perfil oscuro, lujoso y minimalista. Afinidad orientativa: 25 a 50 años; sus notas pueden funcionar a cualquier edad según tus gustos y la imagen que deseas proyectar.",
    "wearingTips": [
      "Rinde mejor en clima frío.",
      "El rango de edad es orientativo; prioriza siempre tus gustos y la imagen que quieres proyectar."
    ],
    "image": {
      "path": "IMAGES/Caballero/CP02316.avif",
      "alt": "ARMANI EMPORIO ARMANI STRONGER WITH YOU OUD"
    }
  },
  "provenance": {
    "lastReviewedAt": "2026-07-30",
    "reviewedBy": "PRIVÉ — revisión de lote",
    "confidence": "low",
    "sources": [
      {
        "type": "internal",
        "title": "Catálogo operativo PRIVÉ",
        "url": null,
        "accessedAt": "2026-07-30",
        "supports": [
          "identity"
        ]
      },
      {
        "type": "internal",
        "title": "Revisión documental PRIVÉ — Lote maestro 001",
        "url": null,
        "accessedAt": "2026-07-30",
        "supports": [
          "classification",
          "olfactory",
          "recommendation",
          "content"
        ]
      }
    ],
    "notes": "Lote maestro 001. Ficha en estado review: validar la pirámide y la tendencia de edad antes de cambiar a verified. La edad es una tendencia secundaria, nunca una restricción de compra."
  }
}
