{
  "schemaVersion": "1.0.0",
  "id": "cp01020-ed-hardy-ed-hardy-love-and-luck-for-men",
  "status": "review",
  "identity": {
    "brand": "ED HARDY",
    "name": "ED HARDY LOVE & LUCK FOR MEN",
    "line": null,
    "flanker": null,
    "priveCode": "CP01020",
    "sku": null,
    "audience": "Caballero",
    "concentration": "Eau de Toilette",
    "launchYear": 2008,
    "perfumers": [],
    "countryOfOrigin": null
  },
  "classification": {
    "family": "Cítrica aromática",
    "subfamily": null,
    "accords": [
      "Cítrico",
      "Especiado",
      "Verde",
      "Amaderado"
    ],
    "styleTags": [
      "Juvenil",
      "Chispeante y aventurero"
    ]
  },
  "olfactory": {
    "topNotes": [
      "Mandarina",
      "Bergamota",
      "Cardamomo"
    ],
    "heartNotes": [
      "Violeta",
      "Ciprés",
      "Salvia"
    ],
    "baseNotes": [
      "Almizcle",
      "Cedro",
      "Vetiver",
      "Oud"
    ],
    "notePyramidConfidence": "medium"
  },
  "performance": {
    "intensity": "Moderada",
    "longevity": "Desconocida",
    "projection": "Desconocida",
    "trail": "Desconocida",
    "longevityHours": {
      "min": null,
      "max": null
    }
  },
  "sensoryProfile": {
    "freshness": 5,
    "sweetness": 0,
    "warmth": 2,
    "woodiness": 5,
    "spiciness": 4,
    "floral": 2,
    "citrus": 5,
    "fruitiness": 0,
    "aquatic": 2,
    "powdery": 4,
    "smoky": 0,
    "leathery": 0
  },
  "recommendation": {
    "occasions": [
      "Día",
      "Noche",
      "Diario",
      "Oficina",
      "Cita"
    ],
    "contexts": [
      "Casual",
      "Profesional",
      "Social"
    ],
    "climates": [
      "Templado",
      "Calor",
      "Frío"
    ],
    "seasons": [
      "Primavera",
      "Otoño",
      "Verano"
    ],
    "dayParts": [
      "Mañana",
      "Tarde",
      "Noche"
    ],
    "formality": 3,
    "versatility": 5,
    "distinctiveness": 4,
    "recommendedAge": {
      "min": 18,
      "max": 40,
      "confidence": "low",
      "framing": "tendency",
      "isRestrictive": false,
      "guidance": "Tendencia orientativa: suele conectar especialmente con personas de 18 a 40 años por su estilo juvenil, chispeante y aventurero. No es una regla ni limita su uso: si te atraen sus notas y la imagen que proyecta, puede funcionar muy bien a cualquier edad. Si buscas una impresión más juvenil o más clásica, el Asesor PRIVÉ puede sugerirte alternativas cercanas."
    }
  },
  "content": {
    "shortDescription": "Una fragancia de perfil cítrico, especiado, verde, con una salida de mandarina, bergamota, cardamomo que evoluciona hacia un fondo de almizcle, cedro, vetiver. Su carácter juvenil, chispeante y aventurero ayuda al Asesor PRIVÉ a ubicarla por gusto, ocasión y clima sin convertir la edad en una regla.",
    "advisorSummary": "Perfil juvenil, chispeante y aventurero. Afinidad orientativa: 18 a 40 años; sus notas pueden funcionar a cualquier edad según tus gustos y la imagen que deseas proyectar.",
    "wearingTips": [
      "Suele rendir mejor en clima templado y calor y frío.",
      "La edad es solo una tendencia de afinidad; prioriza el aroma, la ocasión y la imagen que quieres proyectar."
    ],
    "image": {
      "path": "IMAGES/Caballero/CP01020.avif",
      "alt": "ED HARDY ED HARDY LOVE & LUCK FOR MEN"
    }
  },
  "provenance": {
    "lastReviewedAt": "2026-07-30",
    "reviewedBy": "PRIVÉ — Base Maestra Lote 002",
    "confidence": "medium",
    "sources": [
      {
        "type": "internal",
        "title": "Catálogo operativo PRIVÉ — nombre, imagen, categoría y clave",
        "url": null,
        "accessedAt": "2026-07-30",
        "supports": [
          "identity"
        ]
      },
      {
        "type": "community",
        "title": "Fragrantica — nombre, versión, imagen y contraste olfativo",
        "url": "https://www.fragrantica.com/search/?query=ED+HARDY+ED+HARDY+LOVE+%26+LUCK+FOR+MEN",
        "accessedAt": "2026-07-30",
        "supports": [
          "identity",
          "classification",
          "olfactory"
        ]
      },
      {
        "type": "editorial",
        "title": "Perfumoteca — búsqueda exacta por clave CP01020",
        "url": "https://perfumoteca.com/catalogo",
        "accessedAt": "2026-07-30",
        "supports": [
          "identity",
          "olfactory"
        ]
      }
    ],
    "notes": "Lote maestro 002. Fragrantica y Perfumoteca se registran como fuentes principales complementarias: Fragrantica conserva nombre/versión/imagen; Perfumoteca se consulta por clave y representa la referencia olfativa usada por proveedor y pedidos PRIVÉ. Identidad contrastada por nombre e imagen; clave conservada para búsqueda exacta en Perfumoteca. La ficha permanece en review; no se inventan datos ante diferencias. La edad es orientativa y nunca restrictiva."
  }
}
