{
  "schemaVersion": "1.0.0",
  "id": "cp01012-burberry-hero",
  "status": "review",
  "identity": {
    "brand": "BURBERRY",
    "name": "HERO",
    "line": null,
    "flanker": null,
    "priveCode": "CP01012",
    "sku": null,
    "audience": "Caballero",
    "concentration": "Eau de Toilette",
    "launchYear": 2021,
    "perfumers": [],
    "countryOfOrigin": null
  },
  "classification": {
    "family": "Amaderada especiada",
    "subfamily": null,
    "accords": [
      "Amaderado",
      "Cítrico",
      "Aromático",
      "Especiado"
    ],
    "styleTags": [
      "Minimalista",
      "Limpio y masculino"
    ]
  },
  "olfactory": {
    "topNotes": [
      "Bergamota"
    ],
    "heartNotes": [
      "Enebro",
      "Pimienta negra"
    ],
    "baseNotes": [
      "Cedro del Atlas",
      "Cedro de Virginia",
      "Cedro del Himalaya"
    ],
    "notePyramidConfidence": "low"
  },
  "performance": {
    "intensity": "Moderada",
    "longevity": "Desconocida",
    "projection": "Desconocida",
    "trail": "Desconocida",
    "longevityHours": {
      "min": null,
      "max": null
    }
  },
  "sensoryProfile": {
    "freshness": 2,
    "sweetness": 0,
    "warmth": 0,
    "woodiness": 2,
    "spiciness": 2,
    "floral": 0,
    "citrus": 2,
    "fruitiness": 0,
    "aquatic": 0,
    "powdery": 0,
    "smoky": 0,
    "leathery": 0
  },
  "recommendation": {
    "occasions": [
      "Día",
      "Diario",
      "Oficina",
      "Viaje"
    ],
    "contexts": [
      "Casual",
      "Profesional"
    ],
    "climates": [
      "Calor",
      "Templado"
    ],
    "seasons": [
      "Primavera",
      "Verano",
      "Otoño"
    ],
    "dayParts": [
      "Mañana",
      "Tarde"
    ],
    "formality": 3,
    "versatility": 4,
    "distinctiveness": 3,
    "recommendedAge": {
      "min": 20,
      "max": 48,
      "confidence": "low",
      "framing": "tendency",
      "isRestrictive": false,
      "guidance": "Tendencia orientativa: suele conectar especialmente con personas de 20 a 48 años por su estilo minimalista, limpio y masculino. No es una regla ni limita su uso: si te atraen sus notas y la imagen que proyecta, puede funcionar muy bien a cualquier edad."
    }
  },
  "content": {
    "shortDescription": "Una fragancia de perfil amaderado, cítrico, aromático, con una salida de bergamota que evoluciona hacia un fondo de cedro del atlas, cedro de virginia, cedro del himalaya. Su carácter minimalista, limpio y masculino la hace fácil de ubicar según ocasión y clima.",
    "advisorSummary": "Perfil minimalista, limpio y masculino. Afinidad orientativa: 20 a 48 años; sus notas pueden funcionar a cualquier edad según tus gustos y la imagen que deseas proyectar.",
    "wearingTips": [
      "Rinde mejor en clima calor y templado.",
      "El rango de edad es orientativo; prioriza siempre tus gustos y la imagen que quieres proyectar."
    ],
    "image": {
      "path": "IMAGES/Caballero/CP01012.avif",
      "alt": "BURBERRY HERO"
    }
  },
  "provenance": {
    "lastReviewedAt": "2026-07-30",
    "reviewedBy": "PRIVÉ — revisión de lote",
    "confidence": "low",
    "sources": [
      {
        "type": "internal",
        "title": "Catálogo operativo PRIVÉ",
        "url": null,
        "accessedAt": "2026-07-30",
        "supports": [
          "identity"
        ]
      },
      {
        "type": "internal",
        "title": "Revisión documental PRIVÉ — Lote maestro 001",
        "url": null,
        "accessedAt": "2026-07-30",
        "supports": [
          "classification",
          "olfactory",
          "recommendation",
          "content"
        ]
      }
    ],
    "notes": "Lote maestro 001. Ficha en estado review: validar la pirámide y la tendencia de edad antes de cambiar a verified. La edad es una tendencia secundaria, nunca una restricción de compra."
  }
}
