{
  "schemaVersion": "1.0.0",
  "id": "cp02149-enrique-iglesias-adrenaline",
  "status": "review",
  "identity": {
    "brand": "ENRIQUE IGLESIAS",
    "name": "ADRENALINE",
    "line": null,
    "flanker": null,
    "priveCode": "CP02149",
    "sku": null,
    "audience": "Caballero",
    "concentration": "Eau de Toilette",
    "launchYear": 2014,
    "perfumers": [],
    "countryOfOrigin": null
  },
  "classification": {
    "family": "Amaderada especiada",
    "subfamily": null,
    "accords": [
      "Especiado",
      "Cítrico",
      "Cuero",
      "Amaderado"
    ],
    "styleTags": [
      "Energético",
      "Juvenil y seductor"
    ]
  },
  "olfactory": {
    "topNotes": [
      "Mandarina",
      "Limón",
      "Hojas de violeta"
    ],
    "heartNotes": [
      "Pimienta negra",
      "Azafrán",
      "Pomarose"
    ],
    "baseNotes": [
      "Haba tonka",
      "Cedro",
      "Ante"
    ],
    "notePyramidConfidence": "medium"
  },
  "performance": {
    "intensity": "Moderada",
    "longevity": "Desconocida",
    "projection": "Desconocida",
    "trail": "Desconocida",
    "longevityHours": {
      "min": null,
      "max": null
    }
  },
  "sensoryProfile": {
    "freshness": 5,
    "sweetness": 2,
    "warmth": 2,
    "woodiness": 4,
    "spiciness": 5,
    "floral": 2,
    "citrus": 5,
    "fruitiness": 0,
    "aquatic": 2,
    "powdery": 4,
    "smoky": 0,
    "leathery": 4
  },
  "recommendation": {
    "occasions": [
      "Noche",
      "Cita",
      "Fiesta",
      "Evento"
    ],
    "contexts": [
      "Romántico",
      "Social",
      "Especial"
    ],
    "climates": [
      "Frío",
      "Templado"
    ],
    "seasons": [
      "Otoño",
      "Invierno"
    ],
    "dayParts": [
      "Tarde",
      "Noche"
    ],
    "formality": 2,
    "versatility": 3,
    "distinctiveness": 4,
    "recommendedAge": {
      "min": 18,
      "max": 42,
      "confidence": "low",
      "framing": "tendency",
      "isRestrictive": false,
      "guidance": "Tendencia orientativa: suele conectar especialmente con personas de 18 a 42 años por su estilo energético, juvenil y seductor. No es una regla ni limita su uso: si te atraen sus notas y la imagen que proyecta, puede funcionar muy bien a cualquier edad. Si buscas una impresión más juvenil o más clásica, el Asesor PRIVÉ puede sugerirte alternativas cercanas."
    }
  },
  "content": {
    "shortDescription": "Una fragancia de perfil especiado, cítrico, cuero, con una salida de mandarina, limón, hojas de violeta que evoluciona hacia un fondo de haba tonka, cedro, ante. Su carácter energético, juvenil y seductor ayuda al Asesor PRIVÉ a ubicarla por gusto, ocasión y clima sin convertir la edad en una regla.",
    "advisorSummary": "Perfil energético, juvenil y seductor. Afinidad orientativa: 18 a 42 años; sus notas pueden funcionar a cualquier edad según tus gustos y la imagen que deseas proyectar.",
    "wearingTips": [
      "Suele rendir mejor en clima frío y templado.",
      "La edad es solo una tendencia de afinidad; prioriza el aroma, la ocasión y la imagen que quieres proyectar."
    ],
    "image": {
      "path": "IMAGES/Caballero/CP02149.avif",
      "alt": "ENRIQUE IGLESIAS ADRENALINE"
    }
  },
  "provenance": {
    "lastReviewedAt": "2026-07-30",
    "reviewedBy": "PRIVÉ — Base Maestra Lote 002",
    "confidence": "medium",
    "sources": [
      {
        "type": "internal",
        "title": "Catálogo operativo PRIVÉ — nombre, imagen, categoría y clave",
        "url": null,
        "accessedAt": "2026-07-30",
        "supports": [
          "identity"
        ]
      },
      {
        "type": "community",
        "title": "Fragrantica — nombre, versión, imagen y contraste olfativo",
        "url": "https://www.fragrantica.com/search/?query=ENRIQUE+IGLESIAS+ADRENALINE",
        "accessedAt": "2026-07-30",
        "supports": [
          "identity",
          "classification",
          "olfactory"
        ]
      },
      {
        "type": "editorial",
        "title": "Perfumoteca — búsqueda exacta por clave CP02149",
        "url": "https://perfumoteca.com/catalogo",
        "accessedAt": "2026-07-30",
        "supports": [
          "identity",
          "olfactory"
        ]
      }
    ],
    "notes": "Lote maestro 002. Fragrantica y Perfumoteca se registran como fuentes principales complementarias: Fragrantica conserva nombre/versión/imagen; Perfumoteca se consulta por clave y representa la referencia olfativa usada por proveedor y pedidos PRIVÉ. Identidad contrastada por nombre e imagen; clave conservada para búsqueda exacta en Perfumoteca. La ficha permanece en review; no se inventan datos ante diferencias. La edad es orientativa y nunca restrictiva."
  }
}
