{
  "schemaVersion": "1.0.0",
  "id": "cp02312-carolina-herrera-212-vip-black-red",
  "status": "review",
  "identity": {
    "brand": "CAROLINA HERRERA",
    "name": "212 VIP BLACK RED",
    "line": null,
    "flanker": null,
    "priveCode": "CP02312",
    "sku": null,
    "audience": "Caballero",
    "concentration": "Eau de Parfum",
    "launchYear": 2020,
    "perfumers": [],
    "countryOfOrigin": null
  },
  "classification": {
    "family": "Cuero especiada",
    "subfamily": null,
    "accords": [
      "Especiado",
      "Cuero",
      "Amaderado",
      "Aromático"
    ],
    "styleTags": [
      "Intenso",
      "Provocador y nocturno"
    ]
  },
  "olfactory": {
    "topNotes": [
      "Pimiento morrón",
      "Jengibre",
      "Cardamomo"
    ],
    "heartNotes": [
      "Absenta"
    ],
    "baseNotes": [
      "Cuero",
      "Madera de guayaco"
    ],
    "notePyramidConfidence": "medium"
  },
  "performance": {
    "intensity": "Intensa",
    "longevity": "Desconocida",
    "projection": "Desconocida",
    "trail": "Desconocida",
    "longevityHours": {
      "min": null,
      "max": null
    }
  },
  "sensoryProfile": {
    "freshness": 0,
    "sweetness": 0,
    "warmth": 2,
    "woodiness": 4,
    "spiciness": 5,
    "floral": 0,
    "citrus": 0,
    "fruitiness": 0,
    "aquatic": 0,
    "powdery": 0,
    "smoky": 0,
    "leathery": 2
  },
  "recommendation": {
    "occasions": [
      "Noche",
      "Cita",
      "Fiesta",
      "Evento"
    ],
    "contexts": [
      "Romántico",
      "Social",
      "Especial"
    ],
    "climates": [
      "Frío",
      "Templado"
    ],
    "seasons": [
      "Otoño",
      "Invierno"
    ],
    "dayParts": [
      "Tarde",
      "Noche"
    ],
    "formality": 2,
    "versatility": 3,
    "distinctiveness": 4,
    "recommendedAge": {
      "min": 22,
      "max": 45,
      "confidence": "low",
      "framing": "tendency",
      "isRestrictive": false,
      "guidance": "Tendencia orientativa: suele conectar especialmente con personas de 22 a 45 años por su estilo intenso, provocador y nocturno. No es una regla ni limita su uso: si te atraen sus notas y la imagen que proyecta, puede funcionar muy bien a cualquier edad. Si buscas una impresión más juvenil o más clásica, el Asesor PRIVÉ puede sugerirte alternativas cercanas."
    }
  },
  "content": {
    "shortDescription": "Una fragancia de perfil especiado, cuero, amaderado, con una salida de pimiento morrón, jengibre, cardamomo que evoluciona hacia un fondo de cuero, madera de guayaco. Su carácter intenso, provocador y nocturno ayuda al Asesor PRIVÉ a ubicarla por gusto, ocasión y clima sin convertir la edad en una regla.",
    "advisorSummary": "Perfil intenso, provocador y nocturno. Afinidad orientativa: 22 a 45 años; sus notas pueden funcionar a cualquier edad según tus gustos y la imagen que deseas proyectar.",
    "wearingTips": [
      "Suele rendir mejor en clima frío y templado.",
      "La edad es solo una tendencia de afinidad; prioriza el aroma, la ocasión y la imagen que quieres proyectar."
    ],
    "image": {
      "path": "IMAGES/Caballero/CP02312.avif",
      "alt": "CAROLINA HERRERA 212 VIP BLACK RED"
    }
  },
  "provenance": {
    "lastReviewedAt": "2026-07-30",
    "reviewedBy": "PRIVÉ — Base Maestra Lote 002",
    "confidence": "medium",
    "sources": [
      {
        "type": "internal",
        "title": "Catálogo operativo PRIVÉ — nombre, imagen, categoría y clave",
        "url": null,
        "accessedAt": "2026-07-30",
        "supports": [
          "identity"
        ]
      },
      {
        "type": "community",
        "title": "Fragrantica — nombre, versión, imagen y contraste olfativo",
        "url": "https://www.fragrantica.com/search/?query=CAROLINA+HERRERA+212+VIP+BLACK+RED",
        "accessedAt": "2026-07-30",
        "supports": [
          "identity",
          "classification",
          "olfactory"
        ]
      },
      {
        "type": "editorial",
        "title": "Perfumoteca — búsqueda exacta por clave CP02312",
        "url": "https://perfumoteca.com/catalogo",
        "accessedAt": "2026-07-30",
        "supports": [
          "identity",
          "olfactory"
        ]
      }
    ],
    "notes": "Lote maestro 002. Fragrantica y Perfumoteca se registran como fuentes principales complementarias: Fragrantica conserva nombre/versión/imagen; Perfumoteca se consulta por clave y representa la referencia olfativa usada por proveedor y pedidos PRIVÉ. Identidad contrastada por nombre e imagen; clave conservada para búsqueda exacta en Perfumoteca. La ficha permanece en review; no se inventan datos ante diferencias. La edad es orientativa y nunca restrictiva."
  }
}
