{
  "schemaVersion": "1.0.0",
  "id": "cp02195-armani-armani-code-profumo",
  "status": "review",
  "identity": {
    "brand": "ARMANI",
    "name": "ARMANI CODE PROFUMO",
    "line": null,
    "flanker": null,
    "priveCode": "CP02195",
    "sku": null,
    "audience": "Caballero",
    "concentration": "Parfum",
    "launchYear": 2016,
    "perfumers": [],
    "countryOfOrigin": null
  },
  "classification": {
    "family": "Ámbar especiada",
    "subfamily": null,
    "accords": [
      "Dulce",
      "Especiado",
      "Ámbar",
      "Cuero"
    ],
    "styleTags": [
      "Intenso",
      "Dulce y atrevido"
    ]
  },
  "olfactory": {
    "topNotes": [
      "Mandarina verde",
      "Manzana verde",
      "Cardamomo"
    ],
    "heartNotes": [
      "Flor de azahar",
      "Lavanda",
      "Nuez moscada"
    ],
    "baseNotes": [
      "Haba tonka",
      "Ámbar",
      "Cuero"
    ],
    "notePyramidConfidence": "low"
  },
  "performance": {
    "intensity": "Muy intensa",
    "longevity": "Desconocida",
    "projection": "Desconocida",
    "trail": "Desconocida",
    "longevityHours": {
      "min": null,
      "max": null
    }
  },
  "sensoryProfile": {
    "freshness": 2,
    "sweetness": 4,
    "warmth": 4,
    "woodiness": 0,
    "spiciness": 4,
    "floral": 4,
    "citrus": 2,
    "fruitiness": 2,
    "aquatic": 0,
    "powdery": 2,
    "smoky": 0,
    "leathery": 2
  },
  "recommendation": {
    "occasions": [
      "Noche",
      "Cita",
      "Fiesta"
    ],
    "contexts": [
      "Romántico",
      "Social"
    ],
    "climates": [
      "Frío",
      "Templado"
    ],
    "seasons": [
      "Otoño",
      "Invierno"
    ],
    "dayParts": [
      "Noche"
    ],
    "formality": 2,
    "versatility": 3,
    "distinctiveness": 4,
    "recommendedAge": {
      "min": 20,
      "max": 45,
      "confidence": "low",
      "framing": "tendency",
      "isRestrictive": false,
      "guidance": "Tendencia orientativa: suele conectar especialmente con personas de 20 a 45 años por su estilo intenso, dulce y atrevido. No es una regla ni limita su uso: si te atraen sus notas y la imagen que proyecta, puede funcionar muy bien a cualquier edad."
    }
  },
  "content": {
    "shortDescription": "Una fragancia de perfil dulce, especiado, ámbar, con una salida de mandarina verde, manzana verde, cardamomo que evoluciona hacia un fondo de haba tonka, ámbar, cuero. Su carácter intenso, dulce y atrevido la hace fácil de ubicar según ocasión y clima.",
    "advisorSummary": "Perfil intenso, dulce y atrevido. Afinidad orientativa: 20 a 45 años; sus notas pueden funcionar a cualquier edad según tus gustos y la imagen que deseas proyectar.",
    "wearingTips": [
      "Rinde mejor en clima frío y templado.",
      "El rango de edad es orientativo; prioriza siempre tus gustos y la imagen que quieres proyectar."
    ],
    "image": {
      "path": "IMAGES/Caballero/CP02195.avif",
      "alt": "ARMANI ARMANI CODE PROFUMO"
    }
  },
  "provenance": {
    "lastReviewedAt": "2026-07-30",
    "reviewedBy": "PRIVÉ — revisión de lote",
    "confidence": "low",
    "sources": [
      {
        "type": "internal",
        "title": "Catálogo operativo PRIVÉ",
        "url": null,
        "accessedAt": "2026-07-30",
        "supports": [
          "identity"
        ]
      },
      {
        "type": "internal",
        "title": "Revisión documental PRIVÉ — Lote maestro 001",
        "url": null,
        "accessedAt": "2026-07-30",
        "supports": [
          "classification",
          "olfactory",
          "recommendation",
          "content"
        ]
      }
    ],
    "notes": "Lote maestro 001. Ficha en estado review: validar la pirámide y la tendencia de edad antes de cambiar a verified. La edad es una tendencia secundaria, nunca una restricción de compra."
  }
}
